{"created_at":"2026-07-26T04:28:36.354158","export_config":{},"narration_policy":"confirmed_only","native_scene_bundles":[],"pages":[{"content_hash":"18d6cca0265a319a4b3055c415fba69a0a0372cd8546244721cf521b6fc48a47","language":"zh-CN","mode":"single","narration_version_id":"e1e08f3a-f5fc-4764-9242-f0cd87e1e4ae","order_index":0,"page_id":"snapshot-page","segments":[{"order":1,"rate":"+0%","segment_id":"2738f6b3-7762-4920-aac1-e724fdd59cd0","segment_index":0,"source":"manual","speaker_id":"host","text":"确认稿","voice":""}],"silent":false,"text":"确认稿"}],"project_id":"snapshot-project","scene_manifests":[],"schema_version":1}