{"created_at":"2026-07-26T04:28:36.250564","export_config":{},"narration_policy":"allow_silent_pages","native_scene_bundles":[],"pages":[{"content_hash":null,"language":"auto","mode":"single","narration_version_id":null,"order_index":0,"page_id":"snapshot-silent-page","segments":[],"silent":true,"text":""}],"project_id":"snapshot-silent","scene_manifests":[],"schema_version":1}