{"created_at":"2026-07-26T04:28:36.387406","export_config":{},"narration_policy":"confirmed_only","native_scene_bundles":[{"page_id":"snapshot-page","path":"C:\\Users\\zdy25\\.codex\\worktrees\\cb32\\PPT-silde\\pytest-of-NFUXS\\pytest-2\\test_snapshot_freezes_native_s0\\bundle.json","sha256":"bbbbbbbbbbbbbbbbbbbbbbbbbbbbbbbbbbbbbbbbbbbbbbbbbbbbbbbbbbbbbbbb"}],"pages":[{"content_hash":"d4707f1afc096edb808ceeffce138ff96a8127b5564b88ba1ea9b45f17f82e2d","language":"zh-CN","mode":"single","narration_version_id":"ff44ce24-fd98-45c9-b170-045d2abe1938","order_index":0,"page_id":"snapshot-page","segments":[{"order":1,"rate":"+0%","segment_id":"cd1e56f5-cc35-428c-8511-3effd9f78b83","segment_index":0,"source":"manual","speaker_id":"host","text":"确认稿","voice":""}],"silent":false,"text":"确认稿"}],"project_id":"snapshot-project","scene_manifests":[],"schema_version":1}