{"created_at":"2026-07-26T04:28:36.198426","export_config":{"speakers":[{"id":"host","voice":"voice-1"}],"tts_provider":"fish_audio"},"narration_policy":"confirmed_only","native_scene_bundles":[],"pages":[{"content_hash":"9289450bcd76afd42176c84552f353a0e996ffe060279bbfde404c3d8939adec","language":"zh-CN","mode":"single","narration_version_id":"5586e3c6-19d4-4529-b348-c880a1d64fa6","order_index":0,"page_id":"snapshot-page","segments":[{"order":1,"rate":"+0%","segment_id":"7fde7d33-2f88-4614-ba7d-008769d644a3","segment_index":0,"source":"manual","speaker_id":"host","text":"确认稿","voice":""}],"silent":false,"text":"确认稿"}],"project_id":"snapshot-project","scene_manifests":[],"schema_version":1}