{"created_at":"2026-07-26T04:28:36.300441","export_config":{},"narration_policy":"confirmed_only","native_scene_bundles":[],"pages":[{"content_hash":"7daeccf7b134bc47c93de6b39f9a7eaaede249b7b87152813b9bbb074a4ebbdc","language":"zh-CN","mode":"single","narration_version_id":"2d059a5d-fa5b-404e-b415-eb974b777aad","order_index":0,"page_id":"snapshot-page","segments":[{"order":1,"rate":"+0%","segment_id":"0ed66650-8b71-480b-bfd7-b0e827de3f83","segment_index":0,"source":"manual","speaker_id":"host","text":"确认稿","voice":""}],"silent":false,"text":"确认稿"}],"project_id":"snapshot-project","scene_manifests":[{"page_id":"snapshot-page","path":"C:\\Users\\zdy25\\.codex\\worktrees\\cb32\\PPT-silde\\pytest-of-NFUXS\\pytest-2\\test_snapshot_freezes_sanitize0\\scene.json","sha256":"aaaaaaaaaaaaaaaaaaaaaaaaaaaaaaaaaaaaaaaaaaaaaaaaaaaaaaaaaaaaaaaa"}],"schema_version":1}